"Exquisite Huntmaster","Black","{3}{B}","4","C","(Commander Legends)","Creature — Elf Warrior","4","2","""When Exquisite Huntmaster dies, create a 1/1 green Elf Warrior creature token.
Encore {4}{B} ({4}{B}, Exile this card from your graveyard: For each opponent, create a token copy that attacks that opponent this turn if able. They gain haste. Sacrifice them at the beginning of the next end step. Activate only as a sorcery.)""","0","Lie Setiawan","""• Exiling the card with encore is a cost to activate the ability. Once you announce that you’re activating it, no player may take actions until you’ve finished. They can’t try to remove the card from your graveyard to stop you from paying the cost.
• Opponents who have left the game aren’t counted when determining how many tokens to create.
• The tokens copy only what’s on the original card. Effects that modified that creature when it was previously on the battlefield won’t be copied.
• Each token must attack the appropriate player if able.
• If one of the tokens can’t attack for any reason (such as being tapped), then it doesn’t attack. If there’s a cost associated with having it attack, you aren’t forced to pay that cost, so it doesn’t have to attack in that case either.
• If an effect stops a token from attacking a specific player, that token can attack any player or planeswalker, or not attack at all. If the effect stops the token from attacking a specific player unless a cost is paid, you don’t have to pay that cost unless you want to attack that player.
• If one of the tokens somehow is under another player’s control as the delayed triggered ability resolves, you can’t sacrifice that token. It remains on the battlefield indefinitely, even if you regain control of it later.""","510100","122","","2023-Jan-31_13:39:53","USD","2183","Commander Legends","(CMR)","(cmr)","CMR","[CMR]","[cmr]","CMR","cmr","","0","","Regular","Not Using","Have","","","Commander legends 1/30/23","0","497642","9","$0.14","$1.26","9","9x","","444b75d9-f7c7-4a13-9318-02d7bbd80c9c","226356","","0"
"Eyeblight Assassin","Black","{2}{B}","3","C","(Commander Legends)","Creature — Elf Assassin","2","2","""When Eyeblight Assassin enters the battlefield, target creature an opponent controls gets -1/-1 until end of turn.""","0","Dan Scott","""""","513610","123","","2023-Jan-31_13:39:28","USD","2182","Commander Legends","(CMR)","(cmr)","CMR","[CMR]","[cmr]","CMR","cmr","","0","","Regular","Not Using","Have","","","Commander legends 1/30/23","0","497643","8","$0.14","$1.12","8","8x","","8a480da7-1b5d-41a5-b603-e63af100724a","227070","","0"
"Eyeblight Cullers","Black","{4}{B}","5","C","(Commander Legends)","Creature — Elf Warrior","3","3","""When Eyeblight Cullers dies, create three 1/1 green Elf Warrior creature tokens, then mill three cards. (Put the top three cards of your library into your graveyard.)""","0","Randy Vargas","""""","510105","124","","2023-Jan-31_13:41:46","USD","2184","Commander Legends","(CMR)","(cmr)","CMR","[CMR]","[cmr]","CMR","cmr","","0","","Regular","Not Using","Have","","","Commander legends 1/30/23","0","497644","8","$0.15","$1.20","8","8x","","da777e75-6f1f-4e07-a5ec-e25454a0636c","226357","","0"
"Eyeblight Massacre","Black","{2}{B}{B}","4","C","(Commander Legends)","Sorcery","0","0","""Non-Elf creatures get -2/-2 until end of turn.""","0","Igor Kieryluk","""• Eyeblight Massacre affects only creatures that aren’t Elves at the time it resolves. Creatures that enter the battlefield later in the turn won’t get -2/-2, and creatures that become Elves or stop being Elves won’t get or lose -2/-2.""","512095","125","","2023-Jan-31_13:42:22","USD","2185","Commander Legends","(CMR)","(cmr)","CMR","[CMR]","[cmr]","CMR","cmr","","0","","Regular","Not Using","Have","","","Commander legends 1/30/23","0","497645","8","$0.15","$1.20","8","8x","","be00670b-64a8-428a-8db0-9119efddaa1b","226979","","0"
"Faith's Fetters","White","{3}{W}","4","U","(Commander Legends)","Enchantment — Aura","0","0","""Enchant permanent
When Faith's Fetters enters the battlefield, you gain 4 life.
Enchanted permanent can't attack or block, and its activated abilities can't be activated unless they're mana abilities.""","0","Brian Despain","""• If the target permanent is an illegal target by the time Faith's Fetters tries to resolve, it doesn't resolve. It won't enter the battlefield, so its enters-the-battlefield ability won't trigger.
• Activated abilities contain a colon. They're generally written “[Cost]: [Effect].” Some keywords (such as equip) are activated abilities and will have colons in their reminder text. Loyalty abilities of planeswalkers are activated abilities.
• Faith's Fetters doesn't stop static abilities, triggered abilities, or mana abilities from working. A mana ability is an ability that produces mana, not an ability that costs mana.""","512210","20","","2023-May-14_06:10:10","USD","5453","Commander Legends","(CMR)","(cmr)","CMR","[CMR]","[cmr]","CMR","cmr","","0","","Regular","Not Using","Have","","","Commander legends 1/30/23","0","497540","5","$0.23","$1.15","5","5x","","04a7da8c-a444-4deb-89b9-2fc9e5475bff","226975","","0"
"Fall from Favor","Blue","{2}{U}","3","C","(Commander Legends)","Enchantment — Aura","0","0","""Enchant creature
When Fall from Favor enters the battlefield, tap enchanted creature and you become the monarch.
Enchanted creature doesn't untap during its controller's untap step unless that player is the monarch.""","0","Caio Monteiro","""• If the target creature is an illegal target by the time Fall from Favor tries to resolve, it doesn’t resolve. It won’t enter the battlefield, so its enters-the-battlefield ability won’t trigger.
• The game starts with no monarch. Once an effect makes one player the monarch, the game will have exactly one monarch from that point forward. As a player becomes the monarch, the current monarch (if any) ceases being the monarch.
• There are two inherent triggered abilities associated with being the monarch. These triggered abilities have no source and are controlled by the player who was the monarch at the time the abilities triggered. The full texts of these abilities are “At the beginning of the monarch’s end step, that player draws a card” and “Whenever a creature deals combat damage to the monarch, its controller becomes the monarch.”
• If the triggered ability that causes the monarch to draw a card goes on the stack and a different player becomes the monarch before that ability resolves, the first player will still draw the card.
• If the monarch leaves the game during another player’s turn, that player becomes the monarch. If the monarch leaves the game during their turn, the next player in turn order becomes the monarch.
• If combat damage dealt to the monarch causes that player to lose the game, the triggered ability that causes the controller of the attacking creature to become the monarch doesn’t resolve. In most cases, the controller of the attacking creature will still become the monarch as it is likely their turn.""","510955","68","","2023-Feb-02_00:08:15","USD","2471","Commander Legends","(CMR)","(cmr)","CMR","[CMR]","[cmr]","CMR","cmr","","0","","Regular","Not Using","Have","","","Commander legends 1/30/23","0","497588","9","$0.20","$1.80","9","9x","","e709a18f-b99d-4fa1-ae5c-7f22abd02c0a","226844","","0"
"Farhaven Elf","Green","{2}{G}","3","C","(Commander Legends)","Creature — Elf Druid","1","1","""When Farhaven Elf enters the battlefield, you may search your library for a basic land card, put it onto the battlefield tapped, then shuffle.""","0","Brandon Kitkouski","""""","510330","225","","2023-Feb-05_01:02:52","USD","2656","Commander Legends","(CMR)","(cmr)","CMR","[CMR]","[cmr]","CMR","cmr","","0","","Regular","Not Using","Have","","","Commander legends 1/30/23","0","497745","9","$0.25","$2.25","9","9x","","db681025-f912-4cba-8b89-c57cda2e6d53","226623","","0"
"Fencing Ace","White","{1}{W}","2","U","(Double Masters)","Creature — Human Soldier","1","1","""Double strike""","0","David Rapoza","""""","486104","15","","2023-May-14_06:10:39","USD","5454","Double Masters","(2XM)","(2xm)","2XM","[2XM]","[2xm]","2XM","2xm","","0","","Regular","Not Using","Have","","","Commander legends 1/30/23","0","489688","4","$0.25","$1.00","4","4x","","d5f198c0-5819-42fc-89f5-cad46cf8d5d1","218927","","0"
"Fertilid","Green","{2}{G}","3","C","(Commander Legends)","Creature — Elemental","0","0","""Fertilid enters the battlefield with two +1/+1 counters on it.
{1}{G}, Remove a +1/+1 counter from Fertilid: Target player searches their library for a basic land card, puts it onto the battlefield tapped, then shuffles.""","0","Wayne Reynolds","""• Although the targeted player doesn't need to find a basic land card if they don't want to, that player must shuffle their library.""","511330","226","","2023-Feb-05_01:03:17","USD","2657","Commander Legends","(CMR)","(cmr)","CMR","[CMR]","[cmr]","CMR","cmr","","0","","Regular","Not Using","Have","","","Commander legends 1/30/23","0","497746","9","$0.21","$1.89","9","9x","","11d56da0-6f37-4bd5-8982-940e80bd4282","226914","","0"
"Fiery Cannonade","Red","{2}{R}","3","C","(Commander Legends)","Instant","0","0","""Fiery Cannonade deals 2 damage to each non-Pirate creature.""","0","Ben Wootten","""""","514045","178","","2023-Feb-05_01:15:09","USD","2678","Commander Legends","(CMR)","(cmr)","CMR","[CMR]","[cmr]","CMR","cmr","","0","","Regular","Not Using","Have","","","Commander legends 1/30/23","0","497698","8","$0.25","$2.00","8","8x","","396f1cdf-712b-4518-a0e8-0039303dccdc","227177","","0"
"Filigree Familiar","","{3}","3","C","(Commander Legends)","Artifact Creature — Fox","2","2","""When Filigree Familiar enters the battlefield, you gain 2 life.
When Filigree Familiar dies, draw a card.""","0","Izzy","""""","511305","308","","2023-Mar-19_02:37:25","USD","4725","Commander Legends","(CMR)","(cmr)","CMR","[CMR]","[cmr]","CMR","cmr","","0","","Regular","Not Using","Have","","","Commander legends 1/30/23","0","497828","9","$0.19","$1.71","9","9x","","875df3ef-fab4-455f-bfdb-8f6361b27bf6","226885","","0"
"Fin-Clade Fugitives","Green","{5}{G}","6","C","(Commander Legends)","Creature — Elf Salamander Rogue","7","4","""Fin-Clade Fugitives can't be blocked by creatures with power 2 or less.
Encore {4}{G} ({4}{G}, Exile this card from your graveyard: For each opponent, create a token copy that attacks that opponent this turn if able. They gain haste. Sacrifice them at the beginning of the next end step. Activate only as a sorcery.)""","0","Simon Dominic","""• Once a creature with power 3 or greater has blocked this creature, changing the power of the blocking creature won’t cause this creature to become unblocked.
• Exiling the card with encore is a cost to activate the ability. Once you announce that you’re activating it, no player may take actions until you’ve finished. They can’t try to remove the card from your graveyard to stop you from paying the cost.
• Opponents who have left the game aren’t counted when determining how many tokens to create.
• The tokens copy only what’s on the original card. Effects that modified that creature when it was previously on the battlefield won’t be copied.
• Each token must attack the appropriate player if able.
• If one of the tokens can’t attack for any reason (such as being tapped), then it doesn’t attack. If there’s a cost associated with having it attack, you aren’t forced to pay that cost, so it doesn’t have to attack in that case either.
• If an effect stops a token from attacking a specific player, that token can attack any player or planeswalker, or not attack at all. If the effect stops the token from attacking a specific player unless a cost is paid, you don’t have to pay that cost unless you want to attack that player.
• If one of the tokens somehow is under another player’s control as the delayed triggered ability resolves, you can’t sacrifice that token. It remains on the battlefield indefinitely, even if you regain control of it later.""","514125","227","","2023-Feb-05_01:03:43","USD","2658","Commander Legends","(CMR)","(cmr)","CMR","[CMR]","[cmr]","CMR","cmr","","0","","Regular","Not Using","Have","","","Commander legends 1/30/23","0","497747","8","$0.15","$1.20","8","8x","","3eb7af70-e024-44bf-a52b-209074b005a3","227202","","0"
"Fire Diamond","","{2}","2","C","(Commander Legends)","Artifact","0","0","""Fire Diamond enters the battlefield tapped.
{T}: Add {R}.""","0","Lindsey Look","""""","511280","309","","2023-Feb-13_06:29:47","USD","3767","Commander Legends","(CMR)","(cmr)","CMR","[CMR]","[cmr]","CMR","cmr","","0","","Regular","Not Using","Have","","","Commander legends 1/30/23","0","497829","10","$0.25","$2.50","10","10x","","3f65f1fa-4196-40ba-8ca3-e68560fef392","226892","","0"
"First Response","White","{3}{W}","4","U","(Commander Legends)","Enchantment","0","0","""At the beginning of each upkeep, if you lost life last turn, create a 1/1 white Soldier creature token.""","0","Slawomir Maniak","""• Damage dealt to you causes you to lose that much life.
• First Response looks at the entire previous turn to determine whether its ability triggers or not. It doesn’t matter whether First Response was on the battlefield when you lost life.
• First Response checks only if you lost life during the turn, not whether your life total decreased over the course of the turn. For example, if you lost 2 life and then gained 8 life last turn, First Response’s ability will trigger.
• Only one Soldier will be created no matter how much life was lost.
• The Soldier won’t be able to attack the turn it’s created (unless something gives it haste).""","510630","22","","2023-May-14_06:11:08","USD","5455","Commander Legends","(CMR)","(cmr)","CMR","[CMR]","[cmr]","CMR","cmr","","0","","Regular","Not Using","Have","","","Commander legends 1/30/23","0","497542","4","$0.20","$0.80","4","4x","","0270f9f2-9afe-4bbb-b14c-0e2da7f54dfc","226658","","0"
"Fleshbag Marauder","Black","{2}{B}","3","C","(Commander Legends)","Creature — Zombie Warrior","3","1","""When Fleshbag Marauder enters the battlefield, each player sacrifices a creature.""","0","Mark Zug","""• When its ability resolves, you may sacrifice Fleshbag Marauder itself. If you control no other creatures, you'll have to sacrifice Fleshbag Marauder.
• As Fleshbag Marauder's ability resolves, first the player whose turn it is chooses a creature to sacrifice, then each other player in turn order does the same knowing the choices made before them. Then all those creatures are sacrificed simultaneously.""","510730","128","","2023-Jan-31_13:43:04","USD","2186","Commander Legends","(CMR)","(cmr)","CMR","[CMR]","[cmr]","CMR","cmr","","0","","Regular","Not Using","Have","","","Commander legends 1/30/23","0","497648","10","$0.25","$2.50","10","10x","","4002b3a4-e00e-44ed-8989-d553e5d7d6c8","226668","","0"
"Flood of Recollection","Blue","{U}{U}","2","C","(Commander Legends)","Sorcery","0","0","""Return target instant or sorcery card from your graveyard to your hand. Exile Flood of Recollection.""","0","Magali Villeneuve","""• There are many important moments in the story, but the most crucial—called “story spotlights”—are shown on cards. These cards have the Planeswalker symbol in their text box; this symbol has no effect on gameplay. You can read more about these events in the official Magic fiction at http://www.mtgstory.com.""","510980","61","","2023-Feb-02_00:08:12","USD","2470","Commander Legends","(CMR)","(cmr)","CMR","[CMR]","[cmr]","CMR","cmr","","0","","Regular","Not Using","Have","","","Commander legends 1/30/23","0","497581","8","$0.20","$1.60","8","8x","","c14a5b69-ce04-40fc-9933-20b16537de24","226931","","0"
"Forceful Denial","Blue","{3}{U}{U}","5","C","(Commander Legends)","Instant","0","0","""Cascade (When you cast this spell, exile cards from the top of your library until you exile a nonland card that costs less. You may cast it without paying its mana cost. Put the exiled cards on the bottom of your library in a random order.)
Counter target spell.""","0","Volkan Baǵa","""• The mana value of a split card is determined by the combined mana cost of its two halves. If cascade allows you to cast a split card, you may cast either half but not both halves.
• A spell's mana value is determined only by its mana cost. Ignore any alternative costs, additional costs, cost increases, or cost reductions.
• Cascade triggers when you cast the spell, meaning that it resolves before that spell. If you end up casting the exiled card, it will go on the stack above the spell with cascade.
• When the cascade ability resolves, you must exile cards. The only optional part of the ability is whether or not you cast the last card exiled.
• If a spell with cascade is countered, the cascade ability will still resolve normally.
• You exile the cards face up. All players will be able to see them.
• If you cast a card “without paying its mana cost,” you can't choose to cast it for any alternative costs. You can, however, pay additional costs. If the card has any mandatory additional costs, you must pay those to cast the card.
• If the card has {X} in its mana cost, you must choose 0 as the value of X when casting it without paying its mana cost.
• Due to a recent rules change to cascade, not only do you stop exiling cards if you exile a nonland card with lesser mana value than the spell with cascade, but the resulting spell you cast must also have lesser mana value. Previously, in cases where a card's mana value differed from the resulting spell, such as with some modal double-faced cards or cards with an Adventure, you could cast a spell with a higher mana value than the exiled card.
• You can't cast Forceful Denial targeting itself just to cascade.""","510440","69","","2023-Feb-02_00:08:34","USD","2472","Commander Legends","(CMR)","(cmr)","CMR","[CMR]","[cmr]","CMR","cmr","","0","","Regular","Not Using","Have","","","Commander legends 1/30/23","0","497589","10","$0.20","$2.00","10","10x","","27c75157-2670-4804-8853-a6867c83c40a","226390","","0"
"Foundry Inspector","","{3}","3","C","(Commander Legends)","Artifact Creature — Construct","3","2","""Artifact spells you cast cost {1} less to cast.""","0","Jason A. Engle","""• If an artifact spell has {X} in its mana cost, choose the value for X first, and then reduce the cost by {1}. For example, an artifact that costs {X} with X chosen as 4 costs {3} to cast if you control Foundry Inspector.
• Once a player has announced an artifact spell, no player may take actions to try to remove Foundry Inspector from the battlefield before that spell's cost is locked in.""","514235","310","","2023-Mar-19_02:42:51","USD","4726","Commander Legends","(CMR)","(cmr)","CMR","[CMR]","[cmr]","CMR","cmr","","0","","Regular","Not Using","Have","","","Commander legends 1/30/23","0","497830","9","$0.25","$2.25","9","9x","","cca62547-7dd3-4bb7-be5f-92c4fa51904d","227121","","0"
"Fyndhorn Elves","Green","{G}","1","C","(Commander Legends)","Creature — Elf Druid","1","1","""{T}: Add {G}.""","0","Igor Kieryluk","""""","510335","228","","2023-Feb-05_01:04:23","USD","2659","Commander Legends","(CMR)","(cmr)","CMR","[CMR]","[cmr]","CMR","cmr","","0","","Regular","Not Using","Have","","","Commander legends 1/30/23","0","497748","10","$0.78","$7.80","10","10x","","450744cf-7eba-491b-97b0-ca80c6368bbb","226624","","0"
"Galestrike","Blue","{2}{U}","3","C","(Commander Legends)","Instant","0","0","""Return target tapped creature to its owner's hand.
Draw a card.""","0","Mike Bierek","""• If the target creature is an illegal target by the time Galestrike tries to resolve, the spell doesn’t resolve. You don’t draw a card.""","513005","70","","2023-Feb-02_00:08:11","USD","2469","Commander Legends","(CMR)","(cmr)","CMR","[CMR]","[cmr]","CMR","cmr","","0","","Regular","Not Using","Have","","","Commander legends 1/30/23","0","497590","9","$0.15","$1.35","9","9x","","c23cdb0e-2684-4ad1-b7dd-e355e3e9a221","227018","","0"
"Ghastly Demise","Black","{B}","1","C","(Commander Legends)","Instant","0","0","""Destroy target nonblack creature if its toughness is less than or equal to the number of cards in your graveyard.""","0","Gary Ruddell","""• Ghastly Demise can target any nonblack creature. Compare the creature’s toughness to the number of cards in your graveyard as Ghastly Demise resolves to see if that creature is destroyed.
• Because Ghastly Demise isn’t put into your graveyard until it’s finished resolving, it won’t be counted when determining whether the creature is destroyed.""","512185","129","","2023-Jan-31_13:44:22","USD","2187","Commander Legends","(CMR)","(cmr)","CMR","[CMR]","[cmr]","CMR","cmr","","0","","Regular","Not Using","Have","","","Commander legends 1/30/23","0","497649","9","$0.16","$1.44","9","9x","","7fcfe11a-fcc9-41e1-91ef-755bb4e22389","226971","","0"
"Gift of Paradise","Green","{2}{G}","3","C","(Commander Legends)","Enchantment — Aura","0","0","""Enchant land
When Gift of Paradise enters the battlefield, you gain 3 life.
Enchanted land has ""{T}: Add two mana of any one color.""""","0","Ryan Pancoast","""• If the target land is an illegal target by the time Gift of Paradise tries to resolve, it doesn’t resolve. It won’t enter the battlefield, so its enters-the-battlefield ability won’t trigger.""","510645","229","","2023-Feb-05_01:04:55","USD","2660","Commander Legends","(CMR)","(cmr)","CMR","[CMR]","[cmr]","CMR","cmr","","0","","Regular","Not Using","Have","","","Commander legends 1/30/23","0","497749","9","$0.19","$1.71","9","9x","","00b361e3-8aaa-4194-8ae8-45bdb70c97bb","226659","","0"
"Goblin Trailblazer","Red","{1}{R}","2","C","(Commander Legends)","Creature — Goblin Pirate","2","1","""Menace (This creature can't be blocked except by two or more creatures.)""","0","Josh Hass","""""","514055","182","","2023-Feb-05_01:15:40","USD","2679","Commander Legends","(CMR)","(cmr)","CMR","[CMR]","[cmr]","CMR","cmr","","0","","Regular","Not Using","Have","","","Commander legends 1/30/23","0","497702","10","$0.15","$1.50","10","10x","","ca382425-2454-4300-b903-fdefd31582d3","227182","","0"
"Golem Artisan","","{5}","5","U","(Commander Legends)","Artifact Creature — Golem","3","3","""{2}: Target artifact creature gets +1/+1 until end of turn.
{2}: Target artifact creature gains your choice of flying, trample, or haste until end of turn.""","0","Nic Klein","""• Golem Artisan can be the target of its own abilities.
• You don't choose whether the target artifact creature gains flying, trample, or haste until Golem Artisan's second ability resolves.""","512150","311","","2023-Jan-30_20:52:56","USD","1929","Commander Legends","(CMR)","(cmr)","CMR","[CMR]","[cmr]","CMR","cmr","","0","","Regular","Not Using","Have","","","Commander legends 1/30/23","0","497831","4","$0.20","$0.80","4","4x","","441a3345-2507-46ed-bdb3-c5c45d17da51","226961","","0"
"Grafted Wargear","","{3}","3","U","(Commander Legends)","Artifact — Equipment","0","0","""Equipped creature gets +3/+2.
Whenever Grafted Wargear becomes unattached from a permanent, sacrifice that permanent.
Equip {0} ({0}: Attach to target creature you control. Equip only as a sorcery.)""","0","Alex Horley-Orlandelli","""• Grafted Wargear becomes unattached from the creature it’s equipping if you equip it to a new creature, if Grafted Wargear leaves the battlefield, if the equipped creature ceases to be a creature, or if Grafted Wargear ceases to be an Equipment. (It also becomes unattached if the equipped creature leaves the battlefield, but the triggered ability won’t do anything in that case.)
• You may activate this card’s equip ability targeting the creature that it is currently attached to, even if it’s the only creature you control. Since the equip ability costs zero, you can do this as many times as you like during your main phases, though it generally won’t do anything.
• If your Grafted Wargear somehow ends up on an opponent’s creature and it then becomes unattached from that creature, you won’t be able to sacrifice that creature because you don’t control it.""","514240","312","","2023-Jan-30_20:53:02","USD","1935","Commander Legends","(CMR)","(cmr)","CMR","[CMR]","[cmr]","CMR","cmr","","0","","Regular","Not Using","Have","","","Commander legends 1/30/23","0","497832","3","$0.25","$0.75","3","3x","","1d023d44-482e-4f60-b9b1-eede9bfb732f","227124","","0"
"Guildless Commons","Land","","0","U","(Commander Legends)","Land","0","0","""Guildless Commons enters the battlefield tapped.
When Guildless Commons enters the battlefield, return a land you control to its owner's hand.
{T}: Add {C}{C}.""","0","Cliff Childs","""""","513755","351","","2023-Jan-30_20:52:52","USD","1927","Commander Legends","(CMR)","(cmr)","CMR","[CMR]","[cmr]","CMR","cmr","","0","","Regular","Not Using","Have","","","Commander legends 1/30/23","0","497871","1","$0.49","$0.49","1","1x","","c6c8d290-b5d2-412c-8db9-5a6246f430e8","227074","","0"
"Haunted Cloak","","{3}","3","C","(Commander Legends)","Artifact — Equipment","0","0","""Equipped creature has vigilance, trample, and haste.
Equip {1} ({1}: Attach to target creature you control. Equip only as a sorcery.)""","0","Volkan Baǵa","""• If a creature enters the battlefield under your control and gains haste, but then loses it before attacking, it won’t be able to attack that turn. This means that you can’t use one Haunted Cloak to allow two new creatures to attack in the same turn.""","514829","463","","2023-Mar-19_02:43:39","USD","4727","Commander Legends","(CMR)","(cmr)","CMR","[CMR]","[cmr]","CMR","cmr","","0","","Regular","Not Using","Have","","","Commander legends 1/30/23","0","500943","8","$0.24","$1.92","8","8x","","19ece771-d628-45e7-882d-a35f625d2e55","227366","","0"
